<?xml version="1.0" encoding="UTF-8"?>
<?udm interface="TimeSeries" version="1.00"?>
<xsd:schema xmlns:xsd="http://www.w3.org/2001/XMLSchema"
 elementFormDefault="qualified" 
>
<!-- generated on Thu Mar 23 13:55:46 2006 -->


	<xsd:complexType name="string_dataType">
		<xsd:attribute name="value" type="xsd:string" use="required"/>
		<xsd:attribute name="dst" type="xsd:IDREFS"/>
		<xsd:attribute name="dst_dv" type="xsd:IDREFS"/>
		<xsd:attribute name="_id" type="xsd:ID"/>
		<xsd:attribute name="_archetype" type="xsd:IDREF"/>
		<xsd:attribute name="_derived" type="xsd:IDREFS"/>
		<xsd:attribute name="_instances" type="xsd:IDREFS"/>
		<xsd:attribute name="_desynched_atts" type="xsd:string"/>
		<xsd:attribute name="_real_archetype" type="xsd:boolean"/>
		<xsd:attribute name="_subtype" type="xsd:boolean"/>
	</xsd:complexType>

	<xsd:complexType name="integer_dataType">
		<xsd:attribute name="value" type="xsd:long" use="required"/>
		<xsd:attribute name="dst" type="xsd:IDREFS"/>
		<xsd:attribute name="dst_dv" type="xsd:IDREFS"/>
		<xsd:attribute name="_id" type="xsd:ID"/>
		<xsd:attribute name="_archetype" type="xsd:IDREF"/>
		<xsd:attribute name="_derived" type="xsd:IDREFS"/>
		<xsd:attribute name="_instances" type="xsd:IDREFS"/>
		<xsd:attribute name="_desynched_atts" type="xsd:string"/>
		<xsd:attribute name="_real_archetype" type="xsd:boolean"/>
		<xsd:attribute name="_subtype" type="xsd:boolean"/>
	</xsd:complexType>

	<xsd:complexType name="real_dataType">
		<xsd:attribute name="value" type="xsd:double" use="required"/>
		<xsd:attribute name="dst" type="xsd:IDREFS"/>
		<xsd:attribute name="dst_dv" type="xsd:IDREFS"/>
		<xsd:attribute name="_id" type="xsd:ID"/>
		<xsd:attribute name="_archetype" type="xsd:IDREF"/>
		<xsd:attribute name="_derived" type="xsd:IDREFS"/>
		<xsd:attribute name="_instances" type="xsd:IDREFS"/>
		<xsd:attribute name="_desynched_atts" type="xsd:string"/>
		<xsd:attribute name="_real_archetype" type="xsd:boolean"/>
		<xsd:attribute name="_subtype" type="xsd:boolean"/>
	</xsd:complexType>

	<xsd:complexType name="boolean_dataType">
		<xsd:attribute name="value" type="xsd:boolean" use="required"/>
		<xsd:attribute name="dst" type="xsd:IDREFS"/>
		<xsd:attribute name="dst_dv" type="xsd:IDREFS"/>
		<xsd:attribute name="_id" type="xsd:ID"/>
		<xsd:attribute name="_archetype" type="xsd:IDREF"/>
		<xsd:attribute name="_derived" type="xsd:IDREFS"/>
		<xsd:attribute name="_instances" type="xsd:IDREFS"/>
		<xsd:attribute name="_desynched_atts" type="xsd:string"/>
		<xsd:attribute name="_real_archetype" type="xsd:boolean"/>
		<xsd:attribute name="_subtype" type="xsd:boolean"/>
	</xsd:complexType>

	<xsd:complexType name="data_labelType">
		<xsd:attribute name="name" type="xsd:string"/>
		<xsd:attribute name="src" type="xsd:IDREFS"/>
		<xsd:attribute name="_id" type="xsd:ID"/>
		<xsd:attribute name="_archetype" type="xsd:IDREF"/>
		<xsd:attribute name="_derived" type="xsd:IDREFS"/>
		<xsd:attribute name="_instances" type="xsd:IDREFS"/>
		<xsd:attribute name="_desynched_atts" type="xsd:string"/>
		<xsd:attribute name="_real_archetype" type="xsd:boolean"/>
		<xsd:attribute name="_subtype" type="xsd:boolean"/>
	</xsd:complexType>

	<xsd:complexType name="ContainerType">
		<xsd:sequence>
			<xsd:element name="boolean_data" type="boolean_dataType" minOccurs="0" maxOccurs="unbounded"/>
			<xsd:element name="data_label" type="data_labelType" minOccurs="0" maxOccurs="unbounded"/>
			<xsd:element name="integer_data" type="integer_dataType" minOccurs="0" maxOccurs="unbounded"/>
			<xsd:element name="real_data" type="real_dataType" minOccurs="0" maxOccurs="unbounded"/>
			<xsd:element name="string_data" type="string_dataType" minOccurs="0" maxOccurs="unbounded"/>
			<xsd:element name="time_point" type="time_pointType" minOccurs="0" maxOccurs="unbounded"/>
		</xsd:sequence>
		<xsd:attribute name="_id" type="xsd:ID"/>
		<xsd:attribute name="_archetype" type="xsd:IDREF"/>
		<xsd:attribute name="_derived" type="xsd:IDREFS"/>
		<xsd:attribute name="_instances" type="xsd:IDREFS"/>
		<xsd:attribute name="_desynched_atts" type="xsd:string"/>
		<xsd:attribute name="_real_archetype" type="xsd:boolean"/>
		<xsd:attribute name="_subtype" type="xsd:boolean"/>
	</xsd:complexType>

	<xsd:complexType name="time_pointType">
		<xsd:attribute name="at" type="xsd:double" use="required"/>
		<xsd:attribute name="src_tp" type="xsd:IDREFS"/>
		<xsd:attribute name="_id" type="xsd:ID"/>
		<xsd:attribute name="_archetype" type="xsd:IDREF"/>
		<xsd:attribute name="_derived" type="xsd:IDREFS"/>
		<xsd:attribute name="_instances" type="xsd:IDREFS"/>
		<xsd:attribute name="_desynched_atts" type="xsd:string"/>
		<xsd:attribute name="_real_archetype" type="xsd:boolean"/>
		<xsd:attribute name="_subtype" type="xsd:boolean"/>
	</xsd:complexType>

 <xsd:element name="Container" type="ContainerType"/>

</xsd:schema>
